{
  "schemaVersion": "1.0.0",
  "commit": "519095930b7deb08606380e7ea9f014ff2b07416",
  "generatedAt": "2026-09-05T17:24:34.455Z",
  "runs": [
    {
      "schemaVersion": "1.0.0",
      "os": "linux",
      "node": 22,
      "commit": "519095930b7deb08606380e7ea9f014ff2b07416",
      "status": "passed",
      "completedAt": "2026-09-05T17:23:30.112Z"
    },
    {
      "schemaVersion": "1.0.0",
      "os": "linux",
      "node": 24,
      "commit": "519095930b7deb08606380e7ea9f014ff2b07416",
      "status": "passed",
      "completedAt": "2026-09-05T17:23:37.197Z"
    },
    {
      "schemaVersion": "1.0.0",
      "os": "linux",
      "node": 26,
      "commit": "519095930b7deb08606380e7ea9f014ff2b07416",
      "status": "passed",
      "completedAt": "2026-09-05T17:23:32.621Z"
    },
    {
      "schemaVersion": "1.0.0",
      "os": "macos",
      "node": 22,
      "commit": "519095930b7deb08606380e7ea9f014ff2b07416",
      "status": "passed",
      "completedAt": "2026-09-05T17:23:32.973Z"
    },
    {
      "schemaVersion": "1.0.0",
      "os": "macos",
      "node": 24,
      "commit": "519095930b7deb08606380e7ea9f014ff2b07416",
      "status": "passed",
      "completedAt": "2026-09-05T17:23:41.343Z"
    },
    {
      "schemaVersion": "1.0.0",
      "os": "macos",
      "node": 26,
      "commit": "519095930b7deb08606380e7ea9f014ff2b07416",
      "status": "passed",
      "completedAt": "2026-09-05T17:23:43.739Z"
    },
    {
      "schemaVersion": "1.0.0",
      "os": "windows",
      "node": 22,
      "commit": "519095930b7deb08606380e7ea9f014ff2b07416",
      "status": "passed",
      "completedAt": "2026-09-05T17:24:18.012Z"
    },
    {
      "schemaVersion": "1.0.0",
      "os": "windows",
      "node": 24,
      "commit": "519095930b7deb08606380e7ea9f014ff2b07416",
      "status": "passed",
      "completedAt": "2026-09-05T17:24:20.519Z"
    },
    {
      "schemaVersion": "1.0.0",
      "os": "windows",
      "node": 26,
      "commit": "519095930b7deb08606380e7ea9f014ff2b07416",
      "status": "passed",
      "completedAt": "2026-09-05T17:24:10.771Z"
    }
  ]
}
